Add support for chromium keyboard lock allowing for system keys and shortcuts,GUACAMOLE-989,13292307,New Feature,Open,GUACAMOLE,Guacamole,software,mjumper,"<p>Apache Guacamole is a <strong>clientless remote desktop gateway</strong>. It supports
standard protocols like VNC, RDP, and SSH.</p>

<p>We call it <em>clientless</em> because no plugins or client software are required.</p>

<p>Once Guacamole is installed on a server, all you need to access your desktops is a web browser.</p>",https://guacamole.apache.org,Minor,,,acplex,acplex,18/Mar/20 00:36,21/May/20 17:49,17/Feb/21 11:13,,,,,,,,,,,,,,2,,,,,"When accessing guacamole in a browser it would be great to have full RDP-like keyboard key and shortcut access. It is very easy to perform actions by special shortcuts (ie, Windows+Key, Alt+Tab) local PC instead of the intended remote PC as well as CTRL key shortcuts on the local browser instead of the remote browser. Another problem is closing the guacamole tab by accident via Ctrl+F4 (I've done this several times!). Some similar issues were voiced in GUACAMOLE-121 regarding CTRL+W.

Please add support for Chromium's system keyboard lock API which allows a rich keyboard experience in full screen mode (you hold ESC for 2 seconds to exit). This would allow using special keys and shortcuts that we use habitually, and habits are hard to break. So why break them? Instead add keyboard lock functionality.

Main page: [https://www.chromestatus.com/feature/5642959835889664]

W3C Spec: [https://wicg.github.io/keyboard-lock/]",,acplex,Delemas,odairmun,Toff,vnick,,,,,,,,,,,,,,,,,,,,,,,,,,,,,,,,,,,,,,,,,,,,,,,,,,,,,,,,,,,,,,,,,,,,,,,0.0,,,,,,,,,,,,,,,,,,,,2020-04-19 15:11:19.83,,,false,,,,,,,,,,,,,,,,,,9223372036854775807,,,Thu May 21 17:44:53 UTC 2020,,,,,,,"0|z0cmrs:",9223372036854775807,,,,,,,,,,,,,,,,,"19/Apr/20 15:11;Toff;I've made a small user script implementing this.

It adds a simple overlay button to go full screen and call the keyboard lock.

It is nice to be able to use most shortcuts again in RDP :)

[https://gist.github.com/toff/ab1ba901dc663297af1fb4b8e630d899]

 

 ","29/Apr/20 18:25;Delemas;This currently tagged as minor, and it doesn't really help me but it is the first attempt to actually fix an issue that drives me batty when using guacamole.  Please consider raising the priority.  The issues this addresses is crippling end users trying to use guacamole.
End users shouldn't need to consider custom browser compiles only to not have critical UI issues when using guacamole.
Basically the browser intercepts something destined to my text editor and does unwanted things.
The worst of which is CTRL w which in many text editor normally deletes a word which I try to use all the time.
Of course Firefox promptly destroys my session closing my guacamole tab in my browser. 
During the switch to web extension addons Firefox disabled all the addons which used to allow customization of keyboard short cuts.
 One currently has to hack the browser code or worse recompile it to get a browser without the CTRL w. 
If we can get chromium working with Toff's  FullScreenGrabKeyboard.user.js  to ""lock"" the keyboard, we may be able nudge Firefox development hard enough that ""this works properly in chromium please fix this use case"" and they might actually do it.","29/Apr/20 19:08;vnick;[~Delemas]: I understand that it is a bigger deal for you and your user base.  The priority is based on the priority for the project, overall, and we have several other things we're trying to finish up for the 1.2.0 release that trump this in terms of priority.

Also, this feature is based on a very new feature in Chrome (and _maybe_ other browsers), and is unlikely to be supported on many of the browsers that people accessing Guacamole would use.  So, while I totally agree that it would be a great feature to have implemented and I'm happy to see it added, I have trouble making it a major or critical priority.","29/Apr/20 19:13;vnick;Also, looking at the code proposed by [~Toff], this would be dependent upon GUACAMOLE-124, as we would have to programmatically know that we were going into Full Screen mode before locking the keyboard.  I would be opposed to a change that locks the keyboard by default as soon as the client starts - this would defeat several things, like the hidden menu (Ctrl-Alt-Shift) that are core designs of Guacamole.","29/Apr/20 19:15;Delemas;[~vnick] Understood the priorities are different. 
 I will be very glad when a packaged guacamole 1.2.0 built against packaged freerdp 2.0 is released. All these snapshot releases built using bash scripts are highly unmaintainable. 
 Please realize from an end user usability point of view, in my opinion, I would tag it critical.
 I realize that is one user opinion.

Really the intercept is needed outside of full screen mode too but the first step is replicating a fix of any sort even if I have to compile a custom browser to do that.
 My dream is to have a check box on guacamole  CTRL ALT SHIFT screen that says intercept all allowable keyboard input for this tab except CTRL ALT SHIFT. That would solve so many problems above and beyond CTRL w.

[~Toff] I've dusted off a Chromium browser just to attempt to use your FullScreenGrabKeyboard.user.js.
 I'm sick of losing sessions every time I delete a word when using Firefox.
 Apparently Tampermonkey does exist for Chromium as well.
 Are you installing FullScreenGrabKeyboard.user.js into guacamole 1.1 directly or are you injecting using Tampermonkey or something similar to apply it?","29/Apr/20 19:40;vnick;{quote}
I will be very glad when a packaged guacamole 1.2.0 built against packaged freerdp 2.0 is released. All these snapshot releases built using bash scripts are highly unmaintainable.
{quote}

Yeah, if you're using it in any sort of a production environment I'd stick with the released code - 1.1.0 - for the time being.  We are working on 1.2.0, and we're already piling up the issues and fixes for 1.3.0 to follow that.  But, I think everyone's day jobs have gotten busier lately, so it's been hard to fit in the time to contribute and review.

{quote}
Really the intercept is needed outside of full screen mode too but the first step is replicating a fix of any sort even if I have to compile a custom browser to do that.
My dream is to have a check box on guacamole  CTRL ALT SHIFT screen that says intercept all allowable keyboard input for this tab except CTRL ALT SHIFT. That would solve so many problems above and beyond CTRL w.
{quote}

I wouldn't be opposed to some sort of option within the hidden menu that enables the keyboard lock and then closes the hidden menu.  This seems reasonable.","29/Apr/20 19:57;Toff;[~Delemas] I use ViolentMonkey to inject the script into guacamole.

Go to your guacamole login page, click on the ViolentMonkey icon, then click the ""+"" to create new script, keep the ""@match"" line.

Copy/paste the script, adjust the ""@match"" line, save and then reload page.

You now have a small button in the top/left corner.

Sometimes I forget to click on it BEFORE login, and then I get in to a new empty session with a different resolution :( I wish it would just resize the screen.

And I'm a Firefox user but I can't live without shortcuts in RDP.","30/Apr/20 15:51;vnick;So, for all of you out there watching this issue and hoping for magic, please be aware that it's more complicated than just going into full screen and enabling keyboard lock.  This may capture *some* keys or key combos that would otherwise propagate down to the browser or system, but it won't capture *all* of them.  The documentation specifically talks about System Handlers:

https://wicg.github.io/keyboard-lock/#system-key-press-handler

The gist of it is that the browser *cannot* stop the underlying platform from handling certain key press sequences, and so in order to get those system-level key presses to be allowed to lock into Chrome you will have to do some level of configuration/registration/modification at the system-level.  In my testing on XFCE on Fedora, Alt-Tab is still intercepted by the window manager and results in the standard Alt-Tab behavior, and that key press is not passed through to the Guacamole connection.

And, lest someone ask if we can add code/plugin/extension to Guacamole to help with these system-level registrations, my inclination is no, that is not something we'd be interested in doing, as it defeats the nature of a ""client-less"" remote desktop system that Guacamole is designed to be.

So, we can give it our best shot and enable the keyboard lock via either menu item or full screen (after GUACAMOLE-124 is merged), but please be aware of the limitations of this feature.  Or, if there's something more that I'm missing in all this, please feel free to offer your input and guidance.","30/Apr/20 16:06;vnick;In case anyone is interested I've added the menu item for this in the Guacamole Hidden menu (Ctrl-Shift-Alt) and opened a Pull Request against the master branch.  I'd welcome any testing or comments on the code - if there's something I missed, or if your testing does show that it actually captures more keys than before, that feedback would be appreciated.

https://github.com/apache/guacamole-client/pull/505","30/Apr/20 17:13;Delemas;[~Toff] that FullScreenGrabKeyboard.user.js is awesome! It captures the CTRL w which was driving me batty and keeps Chrome from getting it.
 Honestly I don't care about the other hotkeys as things like alt-tab are not destructive to the session. I use CTRL w all the time and now I can still type normally.
I retested this and both an xrdp based Ubuntu 18.04 connections and a Windows 10 VM RDP work. First time I used Windows the little FS icon didn't appear but it is there now.
 [~vnick] I would love to try that pull but I'm still hamstringed by the lack of a 1.2.0 release tar. I will try it eventually.
 I am building a new guac 1.2.0 VM where I upgraded to Ubuntu 20.04 to get the new Tomcat. 
 Upgrading my OS I ended up with an upgraded database but in an environment that guac 1.1.0 cannot connect to. Once the guac 1.2.0 gets posted I believe I should be able get the database driver to work.","30/Apr/20 18:48;vnick;[~Delemas]
{quote}
I would love to try that pull but I'm still hamstringed by the lack of a 1.2.0 release tar. I will try it eventually.
I am building a new guac 1.2.0 VM where I upgraded to Ubuntu 20.04 to get the new Tomcat.
Upgrading my OS I ended up with an upgraded database but in an environment that guac 1.1.0 cannot connect to. Once the guac 1.2.0 gets posted I believe I should be able get the database driver to work.
{quote}

Understood.  This feature won't be in the 1.2.0 release - it'll be in 1.3.0.  We'll release a 1.2.0 release tar when we release 1.2.0 - it isn't ready, yet.","20/May/20 13:45;odairmun;I reinforce the request for priority in this change of shortcut keys. We are losing a lot of usability.","20/May/20 16:02;vnick;[~odairmun]:
Thank you for your input.  A few points:
* However, I have already attempted an implementation and have asked for people to try it out.  I have no feedback on it, yet.
* I also continue to question how valuable this will really be, since even the Chromium Keyboard Lock will not prevent the operating system from intercepting key combinations.
* That said, I believe it is likely we will implement it in some form or another (maybe not exactly as it is today), but it will not be in the 1.2.0 release.","20/May/20 17:01;odairmun;Understood. With ALT + TAB I will gain enormous productivity in my environment. Can I implement this?","20/May/20 18:10;vnick;[~odairmun]: In my testing, Alt-Tab was not captured by the keyboard lock, and was still intercepted by the client operating system (not passed through to the remote system).","20/May/20 18:21;odairmun;How do I implement?","20/May/20 18:41;vnick;[~odairmun]: I'm not sure what you're asking.  If you're asking how to capture Alt-Tab and send it to the remote system, I don't think it is possible - the client operating system will always intercept the Alt-Tab key combo and will not pass it through to the browser, so it cannot be intercepted by the keyboard lock API.

If you mean, how do you implement the changes I have made, you need to clone the git repo and then merge the pull request mentioned above, and build the client code.  You can then deploy the resulting WAR file (guacamole/target/guacamole-1.2.0.war) and test it out.","20/May/20 19:06;odairmun;thanks, i will download your change.","21/May/20 11:58;Toff;I've used Guacamole more with my user script (sorry Nick it's a bit more involved to rebuild Guacamole and it must be done server side).

For me, remote Alt+Tab works on both Windows 10 + Chrome and Ubuntu 18.04 + Gnome flashback + Chromium.

I've noticed an important thing while testing on my local network, your site must be using https or you must add the flag {color:#000000}--unsafely-treat-insecure-origin-as-secure=""http://example.com""{color} when launching Chrome. Without this, keyboard.lock will fail.{color:#000000}
{color}

Also the Guacamole hidden menu on Ctrl+Alt+Shift works correctly even with keyboard.lock.","21/May/20 13:09;vnick;Thanks, [~Toff].  There may be some connection between entering full-screen mode and enabling keylock that allows some of the key combinations to work as expected.  I'm definitely using HTTPS, and I tried combinations of full-screen and windowed mode, and didn't really see a change in behavior.  What I did not try was disabling the Alt-Tab key combo on my window manager (XFCE), but I don't know that this is a practical test, since requiring everyone to disable on their client sort of defeats the purpose of the entire exercise :-).","21/May/20 16:47;odairmun;Sorry, I didn't quite understand. What you said is that ALT + TAB should already work normally? I am using HTTPS with invalid certificate. How could you adjust?","21/May/20 17:25;acplex;According to all of the documentation for Keyboard Lock, Alt+Tab and other system key combinations are designed to work. It was basically built for this exact purpose, so it not working would be a bug or configuration problem vs expected behavior.

From [https://www.chromestatus.com/feature/5642959835889664|https://www.chromestatus.com/feature/5642959835889664)]:
{quote}While in fullscreen, this API allows apps to receive keys that are normally handled by the system or the browser like Cmd/Alt-Tab, or Esc.
{quote}
From [https://github.com/WICG/keyboard-lock/blob/gh-pages/explainer.md|https://github.com/WICG/keyboard-lock/blob/gh-pages/explainer.md)]:
{quote}All the browser and OS shortcuts, such as Cmd/Alt+Tab should be used to switch windows on the remote computer, while Escape can be used to cancel a command.
{quote}
From [https://wicg.github.io/keyboard-lock/]:
{quote}Some examples of the keys that may be required are Escape, Alt+Tab, Cmd+`, and Ctrl+N.

By default, these keys are not available to the web application because they are captured by the browser or the underlying operating system. The Keyboard Lock API enables websites to capture and use all available keys allowed by the OS.
{quote}","21/May/20 17:44;Toff;[~odairmun] : what are you testing ?

If you testing Nick's patch you also need to use : [https://github.com/apache/guacamole-client/pull/470]

Because you need to go full screen for keyboard lock to work.

Also you should see the message ""Press and hold Esc to exit fullscreen"" and not ""Press F11 to exit fullscreen"".

I'm not sure it will work with an invalid certificate.

EDIT : it works on [https://expired.badssl.com/]",,,,,,,,,,,,
Add support for querying multiple LDAP servers,GUACAMOLE-957,13284581,New Feature,Open,GUACAMOLE,Guacamole,software,mjumper,"<p>Apache Guacamole is a <strong>clientless remote desktop gateway</strong>. It supports
standard protocols like VNC, RDP, and SSH.</p>

<p>We call it <em>clientless</em> because no plugins or client software are required.</p>

<p>Once Guacamole is installed on a server, all you need to access your desktops is a web browser.</p>",https://guacamole.apache.org,Minor,,,wolfaba,wolfaba,11/Feb/20 13:30,20/May/20 20:21,17/Feb/21 11:13,,,,,guacamole-auth-ldap,,,,,,,,,1,,,,,"Hello,

we have configured guacamole with postgresql (for configuration) and LDAP (for authentication only) in version 1.0.0. The LDAP server are 3 Windows AD servers.

We have configured guacamole LDAP auth with {noformat}
ldap-hostname: SERVER1 SERVER2 SERVER3
{noformat}

During authentication, guacamole connects to first server. If the connection fails, it connectes to seconds server and if this connection fails to, it connects to the third server. It works great in guacamole 1.0.0. But the version 1.0.0 has problem with LDAP groups.

So we have updated to 1.1.0. But in this configuration the multiple LDAP hosts are incorrectly parsed and login does not work with ""Invalid login"" on login page and following error message in the log {noformat}
13:21:24.339 [http-nio-8080-exec-16] ERROR o.a.g.a.ldap.LDAPConnectionService - Binding with the LDAP server at ""SERVER1 SERVER2 SERVER3"" as user ""bind-dn"" failed: ERR_04121_CANNOT_RESOLVE_HOSTNAME Cannot connect to the server, Hostname 'SERVER1 SERVER2 SERVER3' could not be resolved.
13:21:24.340 [http-nio-8080-exec-16] ERROR o.a.g.a.l.AuthenticationProviderService - Unable to bind using search DN ""bind-dn""
13:21:24.342 [http-nio-8080-exec-16] WARN  o.a.g.r.auth.AuthenticationService - Authentication attempt from [10.0.48.1, 127.0.0.1] for user ""ad.user@domain"" failed.
{noformat}

Could you verify this issue? Is there some other possible format for multiple hostnames in *ldap-hostname* attribute? I have already tried to use "","" (comma) instead of space and to use LDAP URI format, but nothing works.

Thank you for you answer.

Regards,

Robert Wolf.
",,bgarlock,mjumper,wolfaba,,,,,,,,,,,,,,,,,,,,,,,,,,,,,,,,,,,,,,,,,,,,,,,,,,,,,,,,,,,,,,,,,,,,,,,,,0.0,,,,,,,,,,,,,,,,,,,,2020-02-11 18:01:27.359,,,false,,,,,,,,,,,,,,,,,,9223372036854775807,,,Wed May 20 20:21:00 UTC 2020,,,,,,,"0|z0bdf4:",9223372036854775807,,,,,,,,,,,,,,,,,"11/Feb/20 18:01;mjumper;The {{ldap-hostname}} parameter takes a single hostname. It's not a bug; that property does not accept multiple values.","11/Feb/20 18:05;wolfaba;Hello Mike,

in the version 1.0.0 I could write multiple hostnames and if I blocked the first server (using iptables -I OUTPUT -j REJECT -d SERVER1) guacamole has used the SERVER2. And same for SERVER3 if both SERVER1 and SERVER2 were inaccessible.

Could you find out, what LDAP library/functions does v1.0.0 use and what the v1.1.0? There must be some change.

If this is not supported anymore, is there any other possibility to enter multiple LDAP servers?

Thank you.","11/Feb/20 18:09;mjumper;{quote}
Could you find out, what LDAP library/functions does v1.0.0 use and what the v1.1.0? There must be some change.
{quote}

http://guacamole.apache.org/releases/1.1.0/#migration-to-the-apache-directory-api

{quote}
If this is not supported anymore, is there any other possibility to enter multiple LDAP servers?
{quote}

It was never supported. If what you were doing was working before, what you were relying on was undocumented behavior that even we were unaware of. It was not an intentional feature.","11/Feb/20 18:19;wolfaba;{quote}It was never supported. If what you were doing was working before, what you were relying on was undocumented behavior that even we were unaware of. It was not an intentional feature.{quote}
OK, thank you :D Then *new feature* is correct :) Thank you for implementing (y)","20/May/20 20:21;bgarlock;This would be a very welcome feature for when we need to patch our AD servers and reboot them, which currently causes a brief outage for end users authenticating.",,,,,,,,,,,,,,,,,,,,,,,,,,,,,,
Connexion availability schedule,GUACAMOLE-1062,13303389,New Feature,Open,GUACAMOLE,Guacamole,software,mjumper,"<p>Apache Guacamole is a <strong>clientless remote desktop gateway</strong>. It supports
standard protocols like VNC, RDP, and SSH.</p>

<p>We call it <em>clientless</em> because no plugins or client software are required.</p>

<p>Once Guacamole is installed on a server, all you need to access your desktops is a web browser.</p>",https://guacamole.apache.org,Minor,,,jcharaoui,jcharaoui,07/May/20 13:09,07/May/20 13:25,17/Feb/21 11:13,,1.1.0,,,guacamole,,,,,,,,,1,,,,,"We'd love to be able to specify, for a given connection or connection group, an hourly timeframe (eg. 2PM to 4PM) during which the connection may be used. A number of minutes before the end of the time slot, the user would receive a message of imminent disconnection. If the user stays connected, then at the end of the time slot the user is simply disconnected automatically.

Our specific use case is to provide remote access to student labs during the present COVID-19 pandemic. These labs are to be used in the context of remote teaching. The challenge is that more than one group of teacher/students are to share the same lab and set of machines.

We need to be able to manage the timeslots for which each users are able to access the machines, otherwise we worry that at the beginning of any given remote class, students from other groups may already be occupying a number of machines. We could do this by creating multiple connexion groups with different schedules, using the same hostnames/machines, and assign access to those connections accordingly.

There's already the ability to limit access per user account, but this isn't ideal as it would prevent users from using any other connection (eg. to free-access labs without a class schedule) outside those limits.",,Foobar64,jcharaoui,,,,,,,,,,,,,,,,,,,,,,,,,,,,,,,,,,,,,,,,,,,,,,,,,,,,,,,,,,,,,,,,,,,,,,,,,,0.0,,,,,,,,,,,,,,,,,,,,,,,false,,,,,,,,,,,,,,,,,,9223372036854775807,,,2020-05-07 13:09:40.0,,,,,,,"0|z0eh20:",9223372036854775807,,,,,,,,,,,,,,,,,,,,,,,,,,,,,,,,,,,,,,,,,,,,,,,,,,,
vnc clipboard support unicode,GUACAMOLE-1043,13300325,New Feature,Open,GUACAMOLE,Guacamole,software,mjumper,"<p>Apache Guacamole is a <strong>clientless remote desktop gateway</strong>. It supports
standard protocols like VNC, RDP, and SSH.</p>

<p>We call it <em>clientless</em> because no plugins or client software are required.</p>

<p>Once Guacamole is installed on a server, all you need to access your desktops is a web browser.</p>",https://guacamole.apache.org,Minor,,,lxmlxm,lxmlxm,22/Apr/20 17:29,23/Apr/20 13:44,17/Feb/21 11:13,,1.1.0,,,VNC,,,,,,,,,0,,,,,"as tigervnc server now support full unicode with clipboard in version 1.10.1

 

when set clipboard to utf-8 in guacamole, it will still in mass when paste

 

how to support Unicode clipboard in  guacamole",,lxmlxm,vnick,,,,,,,,,,,,,,,,,,,,,,,,,,,,,,,,,,,,,,,,,,,,,,,,,,,,,,,,,,,,,,,,,,,,,,,,,,0.0,,,,,,,,,,,,,,,,,,,,2020-04-22 19:17:32.329,,,false,,,,,,,,,,,,,,,,,,9223372036854775807,,,Thu Apr 23 13:44:26 UTC 2020,,,,,,,"0|z0dygg:",9223372036854775807,,,,,,,,,,,,,,,,,"22/Apr/20 19:17;vnick;With VNC support in Guacamole, the underlying libvncserver/libvncclient libraries have to support this functionality, as well, so it may be more than just adding the feature to Guacamole.","23/Apr/20 04:17;lxmlxm;reference to tigervnc's release note `The clipboard now supports full Unicode in the native viewer, WinVNC and Xvnc/libvnc.so`","23/Apr/20 13:44;vnick;See:
https://github.com/LibVNC/x11vnc/issues/77

At present it does not look like the LibVNC libraries support encoding other than Latin-1.",,,,,,,,,,,,,,,,,,,,,,,,,,,,,,,,
