Summary,Issue key,Issue id,Issue Type,Status,Project key,Project name,Project type,Project lead,Project description,Project url,Priority,Resolution,Assignee,Reporter,Creator,Created,Updated,Last Viewed,Resolved,Affects Version/s,Affects Version/s,Fix Version/s,Component/s,Component/s,Component/s,Component/s,Component/s,Component/s,Component/s,Component/s,Due Date,Votes,Labels,Labels,Labels,Labels,Description,Environment,Watchers,Watchers,Watchers,Watchers,Watchers,Watchers,Watchers,Watchers,Watchers,Watchers,Watchers,Watchers,Watchers,Watchers,Watchers,Watchers,Watchers,Watchers,Watchers,Watchers,Watchers,Watchers,Watchers,Watchers,Watchers,Watchers,Watchers,Watchers,Watchers,Watchers,Watchers,Watchers,Watchers,Watchers,Watchers,Watchers,Watchers,Watchers,Watchers,Watchers,Log Work,Original Estimate,Remaining Estimate,Time Spent,Work Ratio,Σ Original Estimate,Σ Remaining Estimate,Σ Time Spent,Security Level,Outward issue link (Blocked),Outward issue link (Blocker),Outward issue link (Blocker),Outward issue link (Dependency),Outward issue link (Duplicate),Outward issue link (Problem/Incident),Outward issue link (Reference),Outward issue link (Reference),Outward issue link (Required),Outward issue link (dependent),Outward issue link (dependent),Outward issue link (dependent),Outward issue link (dependent),Outward issue link (dependent),Outward issue link (dependent),Outward issue link (dependent),Outward issue link (dependent),Outward issue link (dependent),Outward issue link (dependent),Outward issue link (dependent),Outward issue link (dependent),Outward issue link (dependent),Outward issue link (dependent),Attachment,Attachment,Custom field (Affects version (Component)),Custom field (Attachment count),Custom field (Blog - New Blog Administrators),Custom field (Blog - New Blog PMC),Custom field (Blog - Write access),Custom field (Blog Administrator?),Custom field (Blogs - Admin for blog),Custom field (Blogs - Email Address),Custom field (Blogs - Existing Blog Access Level),Custom field (Blogs - Existing Blog Name),Custom field (Blogs - New Blog Write Access),Custom field (Blogs - Username),Custom field (Bug Category),Custom field (Bugzilla - Email Notification Address),Custom field (Bugzilla - List of usernames),Custom field (Bugzilla - PMC Name),Custom field (Bugzilla - Project Name),Custom field (Bugzilla Id),Custom field (Bugzilla Id),Custom field (Change Category),Custom field (Complexity),Custom field (Date of First Response),Custom field (Discovered By),Custom field (Docs Text),Custom field (Enable Automatic Patch Review),Custom field (Epic Link),Custom field (Estimated Complexity),Custom field (Evidence Of Open Source Adoption),Custom field (Evidence Of Registration),Custom field (Evidence Of Use On World Wide Web),Custom field (Existing GitBox Approval),Custom field (External issue ID),Custom field (External issue URL),Custom field (Fix version (Component)),Custom field (Flags),Custom field (Git Notification Mailing List),Custom field (Git Repository Import Path),Custom field (Git Repository Name),Custom field (Git Repository Type),Custom field (GitHub Options),Custom field (Github Integration),Custom field (Github Integrations - Other),Custom field (Global Rank),Custom field (INFRA - Subversion Repository Path),Custom field (Initial Confluence Contributors),Custom field (Last public comment date),Custom field (Level of effort),Custom field (Machine Readable Info),Custom field (New-TLP-TLPName),Custom field (Priority),Custom field (Project),Custom field (Protected Branch),Custom field (Rank),Custom field (Rank (Obsolete)),Custom field (Review Date),Custom field (Reviewer),Custom field (Severity),Custom field (Severity),Custom field (Skill Level),Custom field (Source Control Link),Custom field (Space Description),Custom field (Space Key),Custom field (Space Name),Custom field (Tags),Custom field (Target Version/s),Custom field (Target Version/s),Custom field (Test and Documentation Plan),Custom field (Testcase included),Custom field (Tester),Custom field (Workaround),Comment,Comment,Comment,Comment,Comment,Comment,Comment,Comment,Comment,Comment,Comment,Comment,Comment,Comment,Comment,Comment,Comment,Comment,Comment,Comment,Comment,Comment,Comment,Comment,Comment,Comment,Comment,Comment,Comment,Comment,Comment,Comment,Comment,Comment,Comment
Add support for SSH certificates,GUACAMOLE-1290,13359007,New Feature,Open,GUACAMOLE,Guacamole,software,mjumper,"<p>Apache Guacamole is a <strong>clientless remote desktop gateway</strong>. It supports
standard protocols like VNC, RDP, and SSH.</p>

<p>We call it <em>clientless</em> because no plugins or client software are required.</p>

<p>Once Guacamole is installed on a server, all you need to access your desktops is a web browser.</p>",https://guacamole.apache.org,Major,,,m.passerini,m.passerini,17/Feb/21 08:17,17/Feb/21 08:25,17/Feb/21 11:13,,,,,SSH,,,,,,,,,0,,,,,"Guacamole does not work with SSH certificates. In order to log in with SSH certificates, one would need to include the public key, signed by the CA, in addition to the private key.

More documentation on how this works is provided here:

[https://access.redhat.com/documentation/en-us/red_hat_enterprise_linux/6/html/deployment_guide/sec-using_openssh_certificate_authentication]

The feature was requested first on the user mailing list: [http://mail-archives.apache.org/mod_mbox/guacamole-user/202102.mbox/%3CCALKeL-OJB7FGxdoyekJW-G12-ppdRVJ%2BWs%3DTP%2BAingWcuZEdig%40mail.gmail.com%3E]

 ",,m.passerini,,,,,,,,,,,,,,,,,,,,,,,,,,,,,,,,,,,,,,,,,,,,,,,,,,,,,,,,,,,,,,,,,,,,,,,,,,,0.0,,,,,,,,,,,,,,,,,,,,,,,false,,,,,,,,,,,,,,,,,,9223372036854775807,,,Wed Feb 17 08:25:15 UTC 2021,,,,,,,"0|z0nqs8:",9223372036854775807,,,,,,,,,,,,,,,,,"17/Feb/21 08:25;m.passerini;From what I saw in the code, it should be enough to add a public-key form in the guacamole-client, and modify the REST API of guacamole-server to include the public-key on that side as well. Then edit the logic in this section: [https://github.com/apache/guacamole-server/blob/master/src/common-ssh/key.c#L79] Currently the code is generating the public key from the private key. It should instead use the one provided by the user, if available. And do something like ""ssh -i privatekey -i publickey hostname"".",,,,,,,,,,,,,,,,,,,,,,,,,,,,,,,,,,
Add option to send key events instead of accessing the remote clipboard,GUACAMOLE-1282,13357175,New Feature,Open,GUACAMOLE,Guacamole,software,mjumper,"<p>Apache Guacamole is a <strong>clientless remote desktop gateway</strong>. It supports
standard protocols like VNC, RDP, and SSH.</p>

<p>We call it <em>clientless</em> because no plugins or client software are required.</p>

<p>Once Guacamole is installed on a server, all you need to access your desktops is a web browser.</p>",https://guacamole.apache.org,Major,,,lseki,lseki,05/Feb/21 20:44,05/Feb/21 20:53,17/Feb/21 11:13,,,,,guacamole,,,,,,,,,0,,,,,"Currently Guacamole relies on the VNC protocol's clipboard forwarding to send clipboard contents to the remote machine connected through VNC.

This does not work when the connection is to a QEMU/KVM guest machine through the QEMU/KVM built-in VNC server, as it does not have access to the guest machine's clipboard.

In such case, if a user wants to access the remote machine's clipboard, he/she needs to run a VNC server in the guest machine and ask the hypervisor's administrator to perform the necessary port redirection. This is not user friendly, and it's not always possible to do so.

It would be nice to have an option in Guacamole Menu (Ctrl+Alt+Shift) to toggle between sending the clipboard contents:

a) through VNC protocol's clipboard API; or

b) by sending keystrokes

This way, the user can choose to send keystroke events to the remote machine, and he/she will be able to paste clipboard contents on remote machines running as QEMU/KVM guests.

*Original discussion*

http://mail-archives.apache.org/mod_mbox/guacamole-user/202102.mbox/browser",,lseki,,,,,,,,,,,,,,,,,,,,,,,,,,,,,,,,,,,,,,,,,,,,,,,,,,,,,,,,,,,,,,,,,,,,,,,,,,,0.0,,,,,,,,,,,,,,,,,,,,,,,false,,,,,,,,,,,,,,,,,,9223372036854775807,,,2021-02-05 20:44:12.0,,,,,,,"0|z0nfhc:",9223372036854775807,,,,,,,,,,,,,,,,,,,,,,,,,,,,,,,,,,,,,,,,,,,,,,,,,,,
Add opentelemetry support,KARAF-7011,13355081,New Feature,Open,KARAF,Karaf,software,jbonofre,,http://karaf.apache.org,Major,,jbonofre,jbonofre,jbonofre,28/Jan/21 05:07,28/Jan/21 05:07,17/Feb/21 11:13,,,,,decanter,,,,,,,,,0,,,,,"opentelemetry is a framework pretty close in term of concepts to Decanter (we find collectors, exporters, etc). Decanter could support opentelemetry components.",,jbonofre,,,,,,,,,,,,,,,,,,,,,,,,,,,,,,,,,,,,,,,,,,,,,,,,,,,,,,,,,,,,,,,,,,,,,,,,,,,0.0,,,,,,,,,,,,,,,,,,,,,,,false,,,,,,,,,,,,,,,,,,9223372036854775807,,,2021-01-28 05:07:48.0,,,,,,,"0|z0n2ko:",9223372036854775807,,,,,,,,,,,,,,,,,,,,,,,,,,,,,,,,,,,,,,,,,,,,,,,,,,,
Add resources manager,KARAF-7010,13355000,New Feature,Open,KARAF,Karaf,software,jbonofre,,http://karaf.apache.org,Major,,jbonofre,jbonofre,jbonofre,27/Jan/21 18:20,27/Jan/21 18:20,17/Feb/21 11:13,,,,,karaf,,,,,,,,,0,,,,,"The idea is to have a resources controller in karaf to ""allocate/control"" resources for each bundles (or features):
 * number of threads allocated for a bundle
 * % of CPU allocated for a bundle
 * % of memory (heap) allocated for a bundle",,jbonofre,,,,,,,,,,,,,,,,,,,,,,,,,,,,,,,,,,,,,,,,,,,,,,,,,,,,,,,,,,,,,,,,,,,,,,,,,,,0.0,,,,,,,,,,,,,,,,,,,,,,,false,,,,,,,,,,,,,,,,,,9223372036854775807,,,2021-01-27 18:20:04.0,,,,,,,"0|z0n22o:",9223372036854775807,,,,,,,,,,,,,,,,,,,,,,,,,,,,,,,,,,,,,,,,,,,,,,,,,,,
