Add support for RDP touch events (RDPEI),GUACAMOLE-1204,13338288,New Feature,In Progress,GUACAMOLE,Guacamole,software,mjumper,"<p>Apache Guacamole is a <strong>clientless remote desktop gateway</strong>. It supports
standard protocols like VNC, RDP, and SSH.</p>

<p>We call it <em>clientless</em> because no plugins or client software are required.</p>

<p>Once Guacamole is installed on a server, all you need to access your desktops is a web browser.</p>",https://guacamole.apache.org,Minor,,mjumper,jackconiunctio,jackconiunctio,01/Nov/20 11:02,06/Feb/21 21:37,17/Feb/21 11:13,,,,,Documentation,guacamole-common-js,libguac,RDP,,,,,,0,,,,,"When connecting to an RDP server using Guacamole on a touch-enabled device, touch events are translated into mouse events according to the selected mouse emulation mode. This is intentional, but could be improved for those RDP servers that support touch events by adding support for the RDPEI channel.

The RDP protocol has specific support for multi-touch events via RDPEI. Adding support for this channel would allow Guacamole to pass through client-side touch events, allowing normal and direct touch interaction with remote applications that support touch.",,jackconiunctio,mjumper,,,,,,,,,,,,,,,,,,,,,,,,,,,,,,,,,,,,,,,,,,,,,,,,,,,,,,,,,,,,,,,,,,,,,,,,,,0.0,,,,,,,,,,,,,,,,,,,,2020-11-01 18:06:36.533,,,false,,,,,,,,,,,,,,,,,,9223372036854775807,,,Mon Nov 02 12:47:29 UTC 2020,,,,,,,"0|z0k6uw:",9223372036854775807,,,,,,,,,,,,,,,,,"01/Nov/20 18:06;mjumper;{quote}
... a Android Tablet with the latest version of the os ...
{quote}

What specific tablet, what specific version of the OS, what browser, and what specific version of that browser?

{quote}
I studied the Mouse.js file, made some changes, but still no effect.
{quote}

What changes and why did you try making them?

{quote}
How to solve this?
{quote}

That will depend on what is happening here, assuming there is a bug. Testing myself on an Android device, things appear to be working correctly: I can pan and zoom around the display as normal, tap to click, etc. That said, I'm not sure I understand what you are trying to do and what you are expecting to happen when you do it.

What do you mean by ""no panning, no swiping""? You are touching the screen and expecting the Guacamole display to pan around? Or you are expecting that behavior from applications _within_ the remote desktop?","01/Nov/20 19:17;jackconiunctio;Hi Mike, thank you for replying. Sorry that I wasn't clear at the start of this topic.

Specific tablet:: Samsung Galaxy Tab S6 SM-T860
Specific version of the OS: Android 10, Kernel 4.14.117-19479728
Browser: Chrome
Version of Chrome: 86.0.4240.110

This is what I changed in Mouse.js

788 /**
 789 * Whether a gesture is known to be in progress. If false, touch events
 790 * will be ignored.
 791 *
 792 * @private
 793 */
 794 var gesture_in_progress = true;

I altered the value 'false' into 'true'. Expected that it wouldn't ignore the touch events anymore.

I set up this guacamole server to connect to my ubuntu desktop (20.10-01 LTS with Mate as window manager) with XRDP . With the RD client app provided bij the Play store the connection is just what it has to be. When I use Guacamole to connect it is not. 
In this desktop I intend to visit my serverpage with the Chrome browser in kiosmode, Actually, I configured the session with an auto startup of the webpage (Moodle) in kiosmode. Then it looks like a normal page. There is just a huge difference between the usual way of scrolling and moving the page (like with the RD client), I can't move the page with my fingers, like an average webpage does on my tablet. When I use the keyboard and mouse there are no limitations, everything works fine, except for the touchscreen. Is this more clear to you?

 ","01/Nov/20 20:42;mjumper;{quote}
I altered the value 'false' into 'true'. Expected that it wouldn't ignore the touch events anymore.
...
In this desktop I intend to visit my serverpage with the Chrome browser in kiosmode, Actually, I configured the session with an auto startup of the webpage (Moodle) in kiosmode. Then it looks like a normal page. There is just a huge difference between the usual way of scrolling and moving the page (like with the RD client), I can't move the page with my fingers, like an average webpage does on my tablet. When I use the keyboard and mouse there are no limitations, everything works fine, except for the touchscreen. Is this more clear to you?
{quote}

I think there is a misunderstanding here with respect to touch events. Within the remote desktop session, everything is still a mouse. There are no touch events as far as the remote desktop session is concerned. This is not because a flag is set that tells Guacamole not to pass through touch events; it is because there are no touch events sent by Guacamole to the remote desktop whatsoever. The browser within that remote desktop is not going to be aware that you are interacting with it using touch.

To allow mouse-driven remote desktop to work through touch devices, Guacamole implements mouse emulation via touch events. This allows you to click, use the scroll wheel, etc. despite not actually having a mouse locally:

http://guacamole.apache.org/doc/gug/using-guacamole.html#touch-mouse

The traditional panning, pinching, etc. gestures will affect Guacamole's display, not the applications _within_ that display.","02/Nov/20 12:47;jackconiunctio;Hi Mike, thank you very much for your reply. I understand what you mean. Still, why does the mousescroll function not work? Scrolling is enough so my students, can scroll through the page. I tried with two and three fingers but still no effect.

I consider to reinstall Guacamole since this configuation is for development only. And probably the server specs are insufficient? Next week I‘ll build my new server it‘s a giant. So I‘ll be back by that time.

 ",,,,,,,,,,,,,,,,,,,,,,,,,,,,,,,
Add support for multi-monitor connections,GUACAMOLE-288,13067690,New Feature,Open,GUACAMOLE,Guacamole,software,mjumper,"<p>Apache Guacamole is a <strong>clientless remote desktop gateway</strong>. It supports
standard protocols like VNC, RDP, and SSH.</p>

<p>We call it <em>clientless</em> because no plugins or client software are required.</p>

<p>Once Guacamole is installed on a server, all you need to access your desktops is a web browser.</p>",https://guacamole.apache.org,Minor,,,slava1,slava1,28/Apr/17 13:37,01/Feb/21 22:58,17/Feb/21 11:13,,,,,guacamole-client,guacamole-server,,,,,,,,11,,,,,"Hello,

I'm wondering if multi monitor support for RDP (and maybe even VNC?) is on Guacamole's roadmap?  Currently, when we RDP to a workstation with multiple displays, we only see the primary display.  Can't find any options in the connection settings to configure multiple monitors.

I've found a ticket on the old Jira where a developer suggested it may be a trivial fix that involves adding a few flags and then the ticket went quite in 2015...so just wondering if this feature is in fact being added and if there is any ETA for it?

Thank you",,copeland3300,danielm2,delard,drhy,eikoe,graimi,igvazal,kano90,leema,lightspeed,lucasmogari,mjumper,pasik,rabe,robins,slava1,vnick,vtbose_rsi,vwguac,xia,,,,,,,,,,,,,,,,,,,,,,,,,,,,,,,,,,,,,,,,,,,,,,,,,,,,,,,,0.0,,,,,,,,,,,,,,,,,,,,2017-04-28 23:06:23.29,,,false,,,,,,,,,,,,,,,,,,9223372036854775807,,,Mon Feb 01 22:58:55 UTC 2021,,,,,,,"0|i3e8nr:",9223372036854775807,,,,,,,,,,,,,,,,,"28/Apr/17 23:06;mjumper;{quote}
I'm wondering if multi monitor support for RDP (and maybe even VNC?) is on Guacamole's roadmap?
{quote}

The short answer is that this JIRA _is_ the roadmap.

To check whether something is on the Guacamole's roadmap, take a quick search through currently-open issues in JIRA. If something you're looking for isn't present, then the next step is to create an issue requesting that feature, as you have just done.

{quote}
I've found a ticket on the old Jira where a developer suggested it may be a trivial fix that involves adding a few flags and then the ticket went quite in 2015.
{quote}

I doubt that this will be as trivial as implied by that suggestion. Few features boil down to, simply, mapping things to FreeRDP flags. I haven't looked into the level of support within the FreeRDP library, but my main worry would be in how Guacamole should expose those multiple displays to the user.

For multi-monitor support to work well, users would need to be able to:

# Interact with the large, multi-monitor remote desktop despite having only one local monitor.
# Interact with the multi-monitor remote desktop spanning their local multi-monitor setup.

How the above could be achieved is not immediately clear.","29/Nov/19 07:00;leema;[~mjumper] Is multi monitor support addressed in latest version of Guacamole?","29/Nov/19 16:59;vnick;[~leema]: As you can see by the status of the request, it has not been addressed, yet :-).

Also, from Mike's last comment, it isn't even agreed that this change will be addressed.","02/Dec/19 04:43;leema;[~vnick] Since i could see multiple tickets around this multi monitor support, wanted to confirm on the status.

Thanks for confirming.","04/Mar/20 22:29;drhy;@vnick Re your 29/Apr/17 post, in my limited experience of vanilla Microsoft RDP, any remote Windows computer (irrespective of the number of its monitors) can provide a multi-monitor experience if you have multiple local monitors. But if you only have one local monitor Windows RDP won't allow any form of multi-monitor experience.

I've just added my vote :)

-David","29/Apr/20 18:27;danielm2;The very Difficult way around this we've found for now is to manually Stretch a web browser on the users machine they connect from (example a laptop with an external monitor)  across both screens. This is not always easy as windows only allows Maximize on 1 screen.  Once your browser is BIG as you can stretch it, then you connect. Or control-alt-shift Disconnect/Reconnect if you're already connected. This will in effect give you 1 large screen. Also I believe only certain versions of windows workstation allow you to connect RDP using multiple monitor (ie enterprise , and not just PRO) so really the multi monitor is up to the browser at this point.

Although perhaps a way to Merge 2 sessions into 1 where you'd have a LEFT and a RIGHT session 1 each connected to each screen remotely may work, but again, the local windows version may need to support that.

 

-danielm","03/May/20 02:44;vnick;The challenge, here, is in the steps to negotiating multi-monitor support between the client (web browser) and the remote server.  Thinking through this at a high level, we need to:
* Be able to detect multiple available monitors via the web browser (this _might_ be possible with the Presentation API, but I'm not certain about that and how much of it is exposed down to the JS layers).
* Report multiple monitors to the guacd side (this shouldn't be too hard, but means adding this piece of the handshake to the protocol).
* Have guacd negotiate multi-monitor support with the remote side (probably doable, at least in the case of RDP)
* Launch multiple browser windows on the available monitors (again, _might_ be possible with Presentation API, but at the very least non-trivial)
* Ensure that the ordering and orientation of monitors is consistent (probably doable, but not trivial).
* Make sure we don't break things for folks wanting single-monitor support in the meantime - which probably means allowing users to specify (maybe through Preferences) which monitors they want to use...again, doable, but not trivial.
* Figure out what to do with protocols where multi-monitor support is not quite as native as RDP - so, for instance, on SSH, do we always stick to a single monitor, do we try to open multiple terminals on multiple monitors, or...?","21/May/20 20:51;copeland3300;[~danielm2], I had actually never thought about doing it this way, and while I agree it's not the simplest work around, it actually works pretty well.

Good suggestion!

Another way I've done it in the past is to open two (or more) browser windows and log in via RDP as two or more different users. Again, it's a bit clunky, but works OK.

 

Specifically for RDP, I think the way to handle would be to spawn additional browser windows via a clickable links in the ctrl+shift+alt menu for each additional monitor specified as a part of the guac config. That way you wouldn't have to worry about client side detection of capabilities.

Actually this might be useful even when the client in a single screen environment  since you'd be able to control your screens as tiles and do a little more than windows will let you do in terms of tiling your applications. It would also let you tile things that might require full screen. 

Ultimately the issue boils down to if the machine you're connecting to will support multiple monitors. I feel like maybe the other parts are doable.

 

Not sure how to handle this with VNC though. SSH you can just open multiple tabs or browser windows and do multiple sessions that way.","01/Feb/21 22:18;kano90;Are there any news?
In freerdp i can receive multimonitor content so guacamole should split these streams into to individual frames- or am i thinking to simple?","01/Feb/21 22:58;vnick;[~kano90]: No, no news - the JIRA issues will get updated if and when people have time to work on them.

And, yes, it is a little more complicated with a web browser to implement multi-monitor support, even if the underlying RDP library supports it. Currently Guacamole uses the available browser window space as the dimensions for the available screen area that it uses to display the remote connection.

Implementing multi-monitor support in Guacamole would, first, require the ability to detect whether or not the client has multiple monitors attached. This isn't quite as straight-forward as it sounds - there's no easy/built-in way in JavaScript to just query the number of monitors attached. Chrome 66 introduced the Presentation API, which _might_ be able to help with this; however, that doesn't map 1-to-1 in terms of enabling multi-monitor display - in fact, using the presentation API would likely just mean ""sending"" the Guacamole display over to a different screen, and not spanning across multiple monitors.

You could have the user configure/specify multiple monitors, but this would likely end up a very clunky/manual process that would require the user to do things like specify the location and dimension(s) of the monitors. Hardly the ""seamless"" experience we're going for.

So, in the meantime, you have a couple of options:
* Stretch the browser window across multiple monitors, so that Guacamole sees the dimensions of the total of both (all) monitors. Yes, this is clunky.
* Open multiple windows on multiple monitors and make separate connections. Obviously this isn't the same as having true multiple monitors.",,,,,,,,,,,,,,,,,,,,,,,,,
Support for WebUSB,GUACAMOLE-522,13143293,New Feature,Open,GUACAMOLE,Guacamole,software,mjumper,"<p>Apache Guacamole is a <strong>clientless remote desktop gateway</strong>. It supports
standard protocols like VNC, RDP, and SSH.</p>

<p>We call it <em>clientless</em> because no plugins or client software are required.</p>

<p>Once Guacamole is installed on a server, all you need to access your desktops is a web browser.</p>",https://guacamole.apache.org,Minor,,,vnick,vnick,07/Mar/18 18:26,25/Jan/21 17:03,17/Feb/21 11:13,,,,,guacamole-client,guacd,,,,,,,,3,,,,,"The WebUSB API is out and starting to get some cross-browser adoption, but, not surprisingly, being led by Chrome.  It would be really interesting to add this capability to Guacamole - the ability to pass through supported USB devices from the browser to the remote system.  Should be possible with RDP, and also maybe with SSH using sockets?

Anyway, throwing this out there on the list.",,iuselinux07,mjumper,pasik,vnick,,,,,,,,,,,,,,,,,,,,,,,,,,,,,,,,,,,,,,,,,,,,,,,,,,,,,,,,,,,,,,,,,,,,,,,,0.0,,,,,,,,,,,,,,,,,,,,2018-03-07 20:57:32.181,,,false,,,,,,,,,,,,,,,,,,9223372036854775807,,,Mon Jan 25 17:03:49 UTC 2021,,,,,,,"0|i3r013:",9223372036854775807,,,,,,,,,,,,,,,,,"07/Mar/18 20:57;mjumper;++1

We should definitely do this. I personally do not have much subject level knowledge on the WebUSB API and the internals of USB, but I expect first steps here would be to begin outlining the nature of this support and any necessary protocol changes.

As an aside, it's interesting that things like audio input and USB are increasingly well-supported by browsers, while things like an actually useful clipboard API and permission scheme remain the holy grail.","25/Jan/21 17:03;iuselinux07;Any updates on this? I'm in dire need being able to log into remote systems with smart cards. ",,,,,,,,,,,,,,,,,,,,,,,,,,,,,,,,,
Add option to the vnc protocol to disable remote input,GUACAMOLE-1267,13353344,New Feature,Open,GUACAMOLE,Guacamole,software,mjumper,"<p>Apache Guacamole is a <strong>clientless remote desktop gateway</strong>. It supports
standard protocols like VNC, RDP, and SSH.</p>

<p>We call it <em>clientless</em> because no plugins or client software are required.</p>

<p>Once Guacamole is installed on a server, all you need to access your desktops is a web browser.</p>",https://guacamole.apache.org,Minor,,,stefan.esq,stefan.esq,19/Jan/21 19:17,20/Jan/21 11:57,17/Feb/21 11:13,,,,,Documentation,VNC,,,,,,,,0,,,,,"For security reasons it can be a required feature to have remote input disabled when using the VNC protocol (e.g. on remote costumer facing terminals, self service terminals etc).

 

Suggested solution is to add a setting ""disable-server-input"" which when set will send a message to the VNC client asking to disable the input.",,stefan.esq,,,,,,,,,,,,,,,,,,,,,,,,,,,,,,,,,,,,,,,,,,,,,,,,,,,,,,,,,,,,,,,,,,,,,,,,,,,0.0,,,,,,,,,,,,,,,,,,,,,,,false,,,,,,,,,,,,,,,,,,9223372036854775807,,,2021-01-19 19:17:44.0,,,,,,,"0|z0mruo:",9223372036854775807,,,,,,,,,,,,,,,,,,,,,,,,,,,,,,,,,,,,,,,,,,,,,,,,,,,
